Title,Uniform Resource Locator,Descriptio
Introduction To Python Programming,udemy.com/course/pythonforbeginnersintro/,"Introduction To Python Programming53 lectures4.5 hoursBeginnerAvinash JainA Quick and Easy Intro into Python Programming | By Avinash JainCurrent priceFree4.4(34,853 ratings) "
Python Hand-on Solve 200 Problems,udemy.com/course/python-handon/,Python Hand-on Solve 200 Problems200 lectures1.5 hoursAll LevelsTan PhamMost Complete Collection of Python Exerciser and Solution. Cover  from Fundamental to Algorithm and Data Analysis | By Tan PhamCurrent priceFree3.7(286 ratings) 
Python Programming Fundamentals,udemy.com/course/the-complete-python-programming-course/,Python Programming Fundamentals25 lectures3 hoursBeginnerHiTech SquadA comprehensive Python course with illustrated examples and loads of hands on exercises | By HiTech SquadCurrent priceFree3.8(38 ratings) 
Python Basics - Bootcamp,udemy.com/course/python-basics-bootcamp/,"Python Basics - Bootcamp17 lectures1 hourBeginnerKarthik NandulaLearn the basics of python with some example programs to help you solve real-life situations and challenges. | By Karthik NandulaCurrent priceFree4.3(2,373 ratings) "
Fundamentals of Programming using Python 3,udemy.com/course/fundamentals-of-programming-using-python-3/,Fundamentals of Programming using Python 328 lectures4 hoursIntermediateDurga Viswanatha Raju GadirajuBasics of Python Programming for IT Professionals | By Durga Viswanatha Raju GadirajuCurrent priceFree4.2(198 ratings) 
Python for Machine Learning - Part 1,udemy.com/course/python-for-machine-learning-t/,Python for Machine Learning - Part 137 lectures2.5 hoursBeginnerPolani DamodarA Prerequisite to Learn Machine Learning | By Polani DamodarCurrent priceFree4.0(212 ratings) 
Learn Python From Scratch,udemy.com/course/learn-python-from-scratch-w/,Learn Python From Scratch5 lectures32 minsAll LevelsMD. Hasanur Rahaman HasibLearn Python from scratch and go from zero to hero in Python | By MD. Hasanur Rahaman HasibCurrent priceFree2.8(26 ratings) 
Complete Python Masterclass - Learn From Scratch,udemy.com/course/complete-python-masterclass-learn-from-scratch-b/,Complete Python Masterclass - Learn From Scratch5 lectures31 minsAll LevelsMD. Hasanur Rahaman HasibLearn Python from scratch and go from zero to hero in Python | By MD. Hasanur Rahaman HasibCurrent priceFree2.6(50 ratings) 
Python - OOP,udemy.com/course/python-oop/,Python - OOP8 lectures2 hoursBeginnerSzabó Dániel ErnőObject Oriented Awesomeness | By Szabó Dániel ErnőCurrent priceFree4.1(71 ratings) 
Free Python 101 Class Beginners Bootcamp Intro to Python NYC,udemy.com/course/python-101-beginners-coding-bootcamp-free-course/,"Free Python 101 Class Beginners Bootcamp Intro to Python NYC40 lectures2.5 hoursBeginnerShivgan JoshiPython Programming for Beginners Course for your weekends - BREAK THE CODE! From Zero to Hero to Super Hero! | By Shivgan JoshiCurrent priceFree3.7(1,176 ratings) "
"Learn Core Python, Numpy and Pandas",udemy.com/course/learn-core-python-numpy-and-pandas/,"Learn Core Python, Numpy and Pandas64 lectures3 hoursBeginnerVishal Kumar SinghLearn all the importance concepts about Core Python, Numpy and Pandas | By Vishal Kumar SinghCurrent priceFree4.1(288 ratings) "
Complete Python Course: Go From Beginner To Advanced!,udemy.com/course/complete-python-course-zero-to-hero-p/,Complete Python Course: Go From Beginner To Advanced!20 lectures3 hoursAll LevelsABD MuhammadComplete Python course. Learn python from scratch and go from beginner to advanced! | By ABD MuhammadCurrent priceFree3.3(94 ratings) 
Complete Python Course : Go From Beginner to Expert,udemy.com/course/complete-python-course-go-from-beginner-to-expert-w/,Complete Python Course : Go From Beginner to Expert5 lectures31 minsAll LevelsABD MuhammadLearn Python from scratch and go from zero to hero in Python | By ABD MuhammadCurrent priceFree2.7(97 ratings) 
Essential Skills and Concepts for Python,udemy.com/course/essential-skills-and-concepts-for-python-esc4python/,Essential Skills and Concepts for Python5 lectures1 hourIntermediateDerek ArmstrongUse Python programming for data manipulation. | By Derek ArmstrongCurrent priceFree3.9(24 ratings) 
Learn Python 3.6 for Total Beginners,udemy.com/course/python-3-for-total-beginners/,"Learn Python 3.6 for Total Beginners39 lectures6.5 hoursBeginnerMichael S RussellFrom newbie to pro in a day with 7 brain teasing exercises and full solutions provided. | By Michael S RussellCurrent priceFree4.2(2,068 ratings) "
Learn Python from Zero,udemy.com/course/learn-python-from-zero/,Learn Python from Zero12 lectures30 minsBeginnerHassan FulaihPython Crash Course | By Hassan FulaihCurrent priceFree3.9(148 ratings) 
Complete Python 3 Course: Beginner to Advance,udemy.com/course/complete-python-3-course-beginner-to-advance/,Complete Python 3 Course: Beginner to Advance5 lectures35 minsAll LevelsMarufa YasminLearn python from scratch and go from zero to hero in Python. | By Marufa YasminCurrent priceFree2.9(35 ratings) 
Introduction to Text To Speech With Python,udemy.com/course/introduction-to-text-to-speech-with-python/,Introduction to Text To Speech With Python26 lectures2 hoursAll LevelsAhmet AksoyMake your computer speak | By Ahmet AksoyCurrent priceFree4.2(24 ratings) 
The Complete Python Course: Zero to Hero,udemy.com/course/the-complete-python-course-zero-to-hero-l/,The Complete Python Course: Zero to Hero5 lectures41 minsAll LevelsABD MuhammadLearn Python from scratch and go from zero to hero in Python | By ABD MuhammadCurrent priceFree3.0(13 ratings) 
Complete Python Course: Learn Hands On Practically,udemy.com/course/complete-python-course-learn-hands-on-practically-i/,Complete Python Course: Learn Hands On Practically5 lectures30 minsAll LevelsShokal ShahLearn Python from scratch and go from beginner to advanced. | By Shokal ShahCurrent priceFree3.0(36 ratings) 
